<?xml version="1.0"?>
<!DOCTYPE spec SYSTEM "config.dtd"><root><HTMLHeader>/karchan/mud/data/</HTMLHeader><USERHeader>/karchan/mud/tmp/</USERHeader><DATABASEHeader>/karchan/mud/data/</DATABASEHeader><CopyrightHeader>&copy; Copyright Maarten van Leunen</CopyrightHeader><DatabaseName>mud</DatabaseName><DatabaseLogin>mud</DatabaseLogin><DatabasePassword>42rakah</DatabasePassword><DatabaseHost>localhost</DatabaseHost><DatabasePort>3306</DatabasePort><ServerName>www.karchan.org</ServerName><CGIName>/cgi-bin/</CGIName><MudOffLineFile>offline.txt</MudOffLineFile><StdHelpFile>help.txt</StdHelpFile><AuditTrailFile>audit.trail</AuditTrailFile><BigFile>bigfile</BigFile><ErrorFile>error.txt</ErrorFile><MudCgi>/cgi-bin/mud.cgi</MudCgi><EnterCgi>/cgi-bin/enter.cgi</EnterCgi><NewcharCgi>/cgi-bin/newchar.cgi</NewcharCgi><LogonframeCgi>/cgi-bin/logonframe.cgi</LogonframeCgi><LeftframeCgi>/cgi-bin/leftframe.cgi</LeftframeCgi><MMHOST>karchan.org</MMHOST><MMPORT>3339</MMPORT></root>
